"No.","Time","Source","Destination","Protocol","Length","Info"
"1","0.000000","206.127.152.131","192.168.0.10","TCP","66","15152  >  49209 [PSH, ACK] Seq=1 Ack=1 Win=32086 Len=12"
"4","0.021663","206.127.152.131","192.168.0.10","TCP","65","15152  >  49209 [PSH, ACK] Seq=13 Ack=8 Win=32079 Len=11"
"8","0.022798","206.127.152.131","192.168.0.10","TCP","65","15152  >  49209 [PSH, ACK] Seq=24 Ack=15 Win=32072 Len=11"
"12","0.026655","206.127.152.131","192.168.0.10","TCP","240","15152  >  49209 [PSH, ACK] Seq=35 Ack=78 Win=32009 Len=186"
"14","0.027892","206.127.152.131","192.168.0.10","TCP","240","15152  >  49209 [PSH, ACK] Seq=221 Ack=105 Win=31982 Len=186"
"21","0.006390","206.127.152.131","192.168.0.10","TCP","558","15152  >  49209 [PSH, ACK] Seq=407 Ack=215 Win=31872 Len=504"
"22","0.006391","206.127.152.131","192.168.0.10","TCP","570","15152  >  49209 [PSH, ACK] Seq=911 Ack=215 Win=31872 Len=516"
"24","0.001176","206.127.152.131","192.168.0.10","TCP","65","15152  >  49209 [PSH, ACK] Seq=1427 Ack=218 Win=31869 Len=11"
"25","0.015505","206.127.152.131","192.168.0.10","TCP","1506","15152  >  49209 [ACK] Seq=1438 Ack=218 Win=31869 Len=1452"
"27","0.015982","206.127.152.131","192.168.0.10","TCP","1506","15152  >  49209 [ACK] Seq=2890 Ack=218 Win=31869 Len=1452"
"28","0.007975","206.127.152.131","192.168.0.10","TCP","783","[TCP Previous segment not captured] 15152  >  49209 [PSH, ACK] Seq=5794 Ack=218 Win=31869 Len=729"
"33","0.089823","206.127.152.131","192.168.0.10","TCP","65","15152  >  49209 [PSH, ACK] Seq=6523 Ack=229 Win=31858 Len=11"
"37","0.489444","206.127.152.131","192.168.0.10","TCP","65","15152  >  49209 [PSH, ACK] Seq=6534 Ack=229 Win=31858 Len=11"
"38","0.000426","206.127.152.131","192.168.0.10","TCP","69","15152  >  49209 [PSH, ACK] Seq=6545 Ack=229 Win=31858 Len=15"
"42","0.859416","206.127.152.131","192.168.0.10","TCP","65","15152  >  49209 [PSH, ACK] Seq=6560 Ack=240 Win=31847 Len=11"
"43","0.000929","206.127.152.131","192.168.0.10","TCP","69","15152  >  49209 [PSH, ACK] Seq=6571 Ack=240 Win=31847 Len=15"
"47","0.765611","206.127.152.131","192.168.0.10","TCP","65","15152  >  49209 [PSH, ACK] Seq=6586 Ack=251 Win=31836 Len=11"
"48","0.000849","206.127.152.131","192.168.0.10","TCP","69","15152  >  49209 [PSH, ACK] Seq=6597 Ack=251 Win=31836 Len=15"
"52","0.796602","206.127.152.131","192.168.0.10","TCP","65","15152  >  49209 [PSH, ACK] Seq=6612 Ack=262 Win=31825 Len=11"
"54","0.000319","206.127.152.131","192.168.0.10","TCP","69","15152  >  49209 [PSH, ACK] Seq=6623 Ack=262 Win=31825 Len=15"
"57","0.804205","206.127.152.131","192.168.0.10","TCP","65","15152  >  49209 [PSH, ACK] Seq=6638 Ack=273 Win=31814 Len=11"
"58","0.000924","206.127.152.131","192.168.0.10","TCP","69","15152  >  49209 [PSH, ACK] Seq=6649 Ack=273 Win=31814 Len=15"
"64","0.015110","206.127.152.131","192.168.0.10","TCP","65","15152  >  49209 [PSH, ACK] Seq=6664 Ack=284 Win=31803 Len=11"
"65","0.000946","206.127.152.131","192.168.0.10","TCP","69","15152  >  49209 [PSH, ACK] Seq=6675 Ack=284 Win=31803 Len=15"
"69","0.843853","206.127.152.131","192.168.0.10","TCP","65","15152  >  49209 [PSH, ACK] Seq=6690 Ack=295 Win=31792 Len=11"
"70","0.000943","206.127.152.131","192.168.0.10","TCP","69","15152  >  49209 [PSH, ACK] Seq=6701 Ack=295 Win=31792 Len=15"
"75","0.003138","206.127.152.131","192.168.0.10","TCP","232","15152  >  49209 [PSH, ACK] Seq=6716 Ack=309 Win=31778 Len=178"
"76","0.006498","206.127.152.131","192.168.0.10","TCP","558","15152  >  49209 [PSH, ACK] Seq=6894 Ack=309 Win=31778 Len=504"
"80","0.032590","206.127.152.131","192.168.0.10","TCP","61","15152  >  49209 [PSH, ACK] Seq=7398 Ack=316 Win=31771 Len=7"
"93","0.408553","206.127.152.131","192.168.0.10","TCP","65","15152  >  49209 [PSH, ACK] Seq=7405 Ack=324 Win=31763 Len=11"
"94","0.000916","206.127.152.131","192.168.0.10","TCP","69","15152  >  49209 [PSH, ACK] Seq=7416 Ack=324 Win=31763 Len=15"
"98","0.258418","206.127.152.131","192.168.0.10","TCP","69","[TCP Previous segment not captured] 15152  >  49209 [PSH, ACK] Seq=7442 Ack=324 Win=31763 Len=15"
"106","0.022343","206.127.152.131","192.168.0.10","TCP","91","15152  >  49209 [PSH, ACK] Seq=7457 Ack=331 Win=31756 Len=37"
"107","0.001448","206.127.152.131","192.168.0.10","TCP","108","15152  >  49209 [PSH, ACK] Seq=7494 Ack=331 Win=31756 Len=54"
"112","0.001424","206.127.152.131","192.168.0.10","TCP","140","15152  >  49209 [PSH, ACK] Seq=7548 Ack=341 Win=31746 Len=86"
"113","0.003929","206.127.152.131","192.168.0.10","TCP","311","[TCP Previous segment not captured] 15152  >  49209 [PSH, ACK] Seq=10538 Ack=341 Win=31746 Len=257"
"118","0.000819","206.127.152.131","192.168.0.10","TCP","65","15152  >  49209 [PSH, ACK] Seq=10795 Ack=348 Win=31739 Len=11"
"128","0.002233","206.127.152.131","192.168.0.10","TCP","65","15152  >  49209 [PSH, ACK] Seq=10806 Ack=384 Win=31703 Len=11"
"129","0.000912","206.127.152.131","192.168.0.10","TCP","69","15152  >  49209 [PSH, ACK] Seq=10817 Ack=384 Win=31703 Len=15"
"133","0.008106","206.127.152.131","192.168.0.10","TCP","96","15152  >  49209 [PSH, ACK] Seq=10832 Ack=438 Win=31649 Len=42"
"138","0.026395","206.127.152.131","192.168.0.10","TCP","96","15152  >  49209 [PSH, ACK] Seq=10874 Ack=475 Win=31612 Len=42"
"140","0.024948","206.127.152.131","192.168.0.10","TCP","96","15152  >  49209 [PSH, ACK] Seq=10916 Ack=501 Win=31586 Len=42"
"142","0.024076","206.127.152.131","192.168.0.10","TCP","96","15152  >  49209 [PSH, ACK] Seq=10958 Ack=527 Win=31560 Len=42"
"143","0.010329","206.127.152.131","192.168.0.10","TCP","65","15152  >  49209 [PSH, ACK] Seq=11000 Ack=527 Win=31560 Len=11"
"145","0.001041","206.127.152.131","192.168.0.10","TCP","69","15152  >  49209 [PSH, ACK] Seq=11011 Ack=527 Win=31560 Len=15"
"149","0.001389","206.127.152.131","192.168.0.10","TCP","96","15152  >  49209 [PSH, ACK] Seq=11026 Ack=564 Win=31523 Len=42"
"151","0.026023","206.127.152.131","192.168.0.10","TCP","96","15152  >  49209 [PSH, ACK] Seq=11068 Ack=590 Win=31497 Len=42"
"153","0.024442","206.127.152.131","192.168.0.10","TCP","96","15152  >  49209 [PSH, ACK] Seq=11110 Ack=616 Win=31471 Len=42"
"155","0.024893","206.127.152.131","192.168.0.10","TCP","96","15152  >  49209 [PSH, ACK] Seq=11152 Ack=642 Win=31445 Len=42"
"157","0.025128","206.127.152.131","192.168.0.10","TCP","96","15152  >  49209 [PSH, ACK] Seq=11194 Ack=668 Win=31419 Len=42"
"159","0.025781","206.127.152.131","192.168.0.10","TCP","96","15152  >  49209 [PSH, ACK] Seq=11236 Ack=694 Win=31393 Len=42"
"161","0.025354","206.127.152.131","192.168.0.10","TCP","96","15152  >  49209 [PSH, ACK] Seq=11278 Ack=720 Win=31367 Len=42"
"163","0.024771","206.127.152.131","192.168.0.10","TCP","96","15152  >  49209 [PSH, ACK] Seq=11320 Ack=746 Win=31341 Len=42"
"165","0.012991","206.127.152.131","192.168.0.10","TCP","73","15152  >  49209 [PSH, ACK] Seq=11362 Ack=746 Win=31341 Len=19"
"166","0.008851","206.127.152.131","192.168.0.10","TCP","65","15152  >  49209 [PSH, ACK] Seq=11381 Ack=753 Win=31334 Len=11"
"169","0.023609","206.127.152.131","192.168.0.10","TCP","96","15152  >  49209 [PSH, ACK] Seq=11392 Ack=779 Win=32768 Len=42"
"171","0.025779","206.127.152.131","192.168.0.10","TCP","96","15152  >  49209 [PSH, ACK] Seq=11434 Ack=805 Win=32742 Len=42"
"173","0.025162","206.127.152.131","192.168.0.10","TCP","96","15152  >  49209 [PSH, ACK] Seq=11476 Ack=831 Win=32716 Len=42"
"174","0.010324","206.127.152.131","192.168.0.10","TCP","65","15152  >  49209 [PSH, ACK] Seq=11518 Ack=831 Win=32716 Len=11"
"176","0.000848","206.127.152.131","192.168.0.10","TCP","69","15152  >  49209 [PSH, ACK] Seq=11529 Ack=831 Win=32716 Len=15"
"180","0.001618","206.127.152.131","192.168.0.10","TCP","96","15152  >  49209 [PSH, ACK] Seq=11544 Ack=868 Win=32679 Len=42"
"182","0.024584","206.127.152.131","192.168.0.10","TCP","96","15152  >  49209 [PSH, ACK] Seq=11586 Ack=894 Win=32653 Len=42"
"184","0.025002","206.127.152.131","192.168.0.10","TCP","96","15152  >  49209 [PSH, ACK] Seq=11628 Ack=920 Win=32627 Len=42"
"187","0.026554","206.127.152.131","192.168.0.10","TCP","96","15152  >  49209 [PSH, ACK] Seq=11670 Ack=946 Win=32601 Len=42"
"189","0.023933","206.127.152.131","192.168.0.10","TCP","96","15152  >  49209 [PSH, ACK] Seq=11712 Ack=972 Win=32575 Len=42"
"191","0.023473","206.127.152.131","192.168.0.10","TCP","96","15152  >  49209 [PSH, ACK] Seq=11754 Ack=998 Win=32549 Len=42"
"193","0.024729","206.127.152.131","192.168.0.10","TCP","93","15152  >  49209 [PSH, ACK] Seq=11796 Ack=1029 Win=32518 Len=39"
"195","0.023555","206.127.152.131","192.168.0.10","TCP","96","15152  >  49209 [PSH, ACK] Seq=11835 Ack=1055 Win=32492 Len=42"
"196","0.112511","206.127.152.131","192.168.0.10","TCP","65","15152  >  49209 [PSH, ACK] Seq=11877 Ack=1055 Win=32492 Len=11"
"198","0.000908","206.127.152.131","192.168.0.10","TCP","69","15152  >  49209 [PSH, ACK] Seq=11888 Ack=1055 Win=32492 Len=15"
"203","0.023570","206.127.152.131","192.168.0.10","TCP","96","15152  >  49209 [PSH, ACK] Seq=11903 Ack=1092 Win=32455 Len=42"
"204","0.008104","206.127.152.131","192.168.0.10","TCP","109","15152  >  49209 [PSH, ACK] Seq=11945 Ack=1123 Win=32424 Len=55"
"207","0.024301","206.127.152.131","192.168.0.10","TCP","96","15152  >  49209 [PSH, ACK] Seq=12000 Ack=1149 Win=32398 Len=42"
"210","0.025825","206.127.152.131","192.168.0.10","TCP","81","15152  >  49209 [PSH, ACK] Seq=12042 Ack=1172 Win=32375 Len=27"
"211","0.007886","206.127.152.131","192.168.0.10","TCP","96","15152  >  49209 [PSH, ACK] Seq=12069 Ack=1198 Win=32349 Len=42"
"214","0.024004","206.127.152.131","192.168.0.10","TCP","96","15152  >  49209 [PSH, ACK] Seq=12111 Ack=1224 Win=32323 Len=42"
"216","0.024825","206.127.152.131","192.168.0.10","TCP","96","15152  >  49209 [PSH, ACK] Seq=12153 Ack=1250 Win=32297 Len=42"
"218","0.023473","206.127.152.131","192.168.0.10","TCP","96","15152  >  49209 [PSH, ACK] Seq=12195 Ack=1276 Win=32271 Len=42"
"221","0.021526","206.127.152.131","192.168.0.10","TCP","96","15152  >  49209 [PSH, ACK] Seq=12237 Ack=1302 Win=32245 Len=42"
"222","0.044578","206.127.152.131","192.168.0.10","TCP","65","15152  >  49209 [PSH, ACK] Seq=12279 Ack=1313 Win=32234 Len=11"
"224","0.000923","206.127.152.131","192.168.0.10","TCP","69","15152  >  49209 [PSH, ACK] Seq=12290 Ack=1313 Win=32234 Len=15"
"229","0.001439","206.127.152.131","192.168.0.10","TCP","96","15152  >  49209 [PSH, ACK] Seq=12305 Ack=1350 Win=32197 Len=42"
"230","0.007129","206.127.152.131","192.168.0.10","TCP","93","15152  >  49209 [PSH, ACK] Seq=12347 Ack=1381 Win=32166 Len=39"
"235","0.001470","206.127.152.131","192.168.0.10","TCP","93","15152  >  49209 [PSH, ACK] Seq=12386 Ack=1423 Win=32124 Len=39"
"237","0.024750","206.127.152.131","192.168.0.10","TCP","96","15152  >  49209 [PSH, ACK] Seq=12425 Ack=1449 Win=32098 Len=42"
"239","0.024690","206.127.152.131","192.168.0.10","TCP","182","15152  >  49209 [PSH, ACK] Seq=12467 Ack=1480 Win=32067 Len=128"
"243","0.451690","206.127.152.131","192.168.0.10","TCP","65","15152  >  49209 [PSH, ACK] Seq=12595 Ack=1517 Win=32030 Len=11"
"244","0.000877","206.127.152.131","192.168.0.10","TCP","69","15152  >  49209 [PSH, ACK] Seq=12606 Ack=1517 Win=32030 Len=15"
"250","0.023732","206.127.152.131","192.168.0.10","TCP","96","15152  >  49209 [PSH, ACK] Seq=12621 Ack=1580 Win=31967 Len=42"
"252","0.023827","206.127.152.131","192.168.0.10","TCP","93","15152  >  49209 [PSH, ACK] Seq=12663 Ack=1611 Win=31936 Len=39"
"254","0.024457","206.127.152.131","192.168.0.10","TCP","96","15152  >  49209 [PSH, ACK] Seq=12702 Ack=1637 Win=31910 Len=42"
"256","0.025395","206.127.152.131","192.168.0.10","TCP","96","15152  >  49209 [PSH, ACK] Seq=12744 Ack=1663 Win=31884 Len=42"
"258","0.023283","206.127.152.131","192.168.0.10","TCP","96","15152  >  49209 [PSH, ACK] Seq=12786 Ack=1689 Win=31858 Len=42"
"261","0.021592","206.127.152.131","192.168.0.10","TCP","96","15152  >  49209 [PSH, ACK] Seq=12828 Ack=1715 Win=31832 Len=42"
"264","0.001401","206.127.152.131","192.168.0.10","TCP","96","15152  >  49209 [PSH, ACK] Seq=12870 Ack=1752 Win=31795 Len=42"
"266","0.026876","206.127.152.131","192.168.0.10","TCP","182","15152  >  49209 [PSH, ACK] Seq=12912 Ack=1783 Win=31764 Len=128"
"269","0.000947","206.127.152.131","192.168.0.10","TCP","65","15152  >  49209 [PSH, ACK] Seq=13040 Ack=1809 Win=31738 Len=11"
"270","0.000982","206.127.152.131","192.168.0.10","TCP","69","15152  >  49209 [PSH, ACK] Seq=13051 Ack=1809 Win=31738 Len=15"
"277","0.001429","206.127.152.131","192.168.0.10","TCP","96","15152  >  49209 [PSH, ACK] Seq=13066 Ack=1872 Win=31675 Len=42"
"279","0.025595","206.127.152.131","192.168.0.10","TCP","96","15152  >  49209 [PSH, ACK] Seq=13108 Ack=1898 Win=31649 Len=42"
"281","0.025482","206.127.152.131","192.168.0.10","TCP","96","15152  >  49209 [PSH, ACK] Seq=13150 Ack=1924 Win=31623 Len=42"
"283","0.026814","206.127.152.131","192.168.0.10","TCP","182","15152  >  49209 [PSH, ACK] Seq=13192 Ack=1955 Win=31592 Len=128"
"285","0.123002","206.127.152.131","192.168.0.10","TCP","65","15152  >  49209 [PSH, ACK] Seq=13320 Ack=1981 Win=31566 Len=11"
"286","0.000968","206.127.152.131","192.168.0.10","TCP","69","15152  >  49209 [PSH, ACK] Seq=13331 Ack=1981 Win=31566 Len=15"
"291","0.025662","206.127.152.131","192.168.0.10","TCP","96","15152  >  49209 [PSH, ACK] Seq=13346 Ack=2018 Win=31529 Len=42"
"293","0.024102","206.127.152.131","192.168.0.10","TCP","96","15152  >  49209 [PSH, ACK] Seq=13388 Ack=2044 Win=31503 Len=42"
"296","0.026334","206.127.152.131","192.168.0.10","TCP","96","15152  >  49209 [PSH, ACK] Seq=13430 Ack=2070 Win=31477 Len=42"
"297","0.143331","206.127.152.131","192.168.0.10","TCP","65","15152  >  49209 [PSH, ACK] Seq=13472 Ack=2070 Win=31477 Len=11"
"299","0.000886","206.127.152.131","192.168.0.10","TCP","69","15152  >  49209 [PSH, ACK] Seq=13483 Ack=2070 Win=31477 Len=15"
"303","0.001418","206.127.152.131","192.168.0.10","TCP","96","15152  >  49209 [PSH, ACK] Seq=13498 Ack=2107 Win=31440 Len=42"
"305","0.025939","206.127.152.131","192.168.0.10","TCP","96","15152  >  49209 [PSH, ACK] Seq=13540 Ack=2133 Win=31414 Len=42"
"307","0.024291","206.127.152.131","192.168.0.10","TCP","96","15152  >  49209 [PSH, ACK] Seq=13582 Ack=2159 Win=31388 Len=42"
"309","0.026316","206.127.152.131","192.168.0.10","TCP","182","15152  >  49209 [PSH, ACK] Seq=13624 Ack=2190 Win=31357 Len=128"
"314","0.009759","206.127.152.131","192.168.0.10","TCP","96","15152  >  49209 [PSH, ACK] Seq=13752 Ack=2242 Win=32768 Len=42"
"315","0.015519","206.127.152.131","192.168.0.10","TCP","96","15152  >  49209 [PSH, ACK] Seq=13794 Ack=2268 Win=32742 Len=42"
"317","0.065431","206.127.152.131","192.168.0.10","TCP","65","15152  >  49209 [PSH, ACK] Seq=13836 Ack=2268 Win=32742 Len=11"
"318","0.000943","206.127.152.131","192.168.0.10","TCP","69","15152  >  49209 [PSH, ACK] Seq=13847 Ack=2268 Win=32742 Len=15"
"323","0.025369","206.127.152.131","192.168.0.10","TCP","96","15152  >  49209 [PSH, ACK] Seq=13862 Ack=2305 Win=32705 Len=42"
"325","0.024597","206.127.152.131","192.168.0.10","TCP","96","15152  >  49209 [PSH, ACK] Seq=13904 Ack=2331 Win=32679 Len=42"
"328","0.025264","206.127.152.131","192.168.0.10","TCP","96","15152  >  49209 [PSH, ACK] Seq=13946 Ack=2357 Win=32653 Len=42"
"330","0.025714","206.127.152.131","192.168.0.10","TCP","93","15152  >  49209 [PSH, ACK] Seq=13988 Ack=2388 Win=32622 Len=39"
"332","0.024929","206.127.152.131","192.168.0.10","TCP","182","15152  >  49209 [PSH, ACK] Seq=14027 Ack=2419 Win=32591 Len=128"
"336","0.136046","206.127.152.131","192.168.0.10","TCP","65","15152  >  49209 [PSH, ACK] Seq=14155 Ack=2456 Win=32554 Len=11"
"337","0.000910","206.127.152.131","192.168.0.10","TCP","69","15152  >  49209 [PSH, ACK] Seq=14166 Ack=2456 Win=32554 Len=15"
"344","0.001441","206.127.152.131","192.168.0.10","TCP","96","15152  >  49209 [PSH, ACK] Seq=14181 Ack=2519 Win=32491 Len=42"
"346","0.023957","206.127.152.131","192.168.0.10","TCP","96","15152  >  49209 [PSH, ACK] Seq=14223 Ack=2545 Win=32465 Len=42"
"349","0.023430","206.127.152.131","192.168.0.10","TCP","96","15152  >  49209 [PSH, ACK] Seq=14265 Ack=2571 Win=32439 Len=42"
"351","0.023973","206.127.152.131","192.168.0.10","TCP","96","15152  >  49209 [PSH, ACK] Seq=14307 Ack=2597 Win=32413 Len=42"
"352","0.045568","206.127.152.131","192.168.0.10","TCP","65","15152  >  49209 [PSH, ACK] Seq=14349 Ack=2597 Win=32413 Len=11"
"355","0.000032","206.127.152.131","192.168.0.10","TCP","69","15152  >  49209 [PSH, ACK] Seq=14360 Ack=2597 Win=32413 Len=15"
"358","0.001428","206.127.152.131","192.168.0.10","TCP","96","15152  >  49209 [PSH, ACK] Seq=14375 Ack=2634 Win=32376 Len=42"
"361","0.029264","206.127.152.131","192.168.0.10","TCP","96","15152  >  49209 [PSH, ACK] Seq=14417 Ack=2660 Win=32350 Len=42"
"363","0.025737","206.127.152.131","192.168.0.10","TCP","96","15152  >  49209 [PSH, ACK] Seq=14459 Ack=2686 Win=32324 Len=42"
"365","0.027254","206.127.152.131","192.168.0.10","TCP","182","15152  >  49209 [PSH, ACK] Seq=14501 Ack=2717 Win=32293 Len=128"
"368","0.202981","206.127.152.131","192.168.0.10","TCP","65","15152  >  49209 [PSH, ACK] Seq=14629 Ack=2743 Win=32267 Len=11"
"369","0.000928","206.127.152.131","192.168.0.10","TCP","69","15152  >  49209 [PSH, ACK] Seq=14640 Ack=2743 Win=32267 Len=15"
"374","0.025051","206.127.152.131","192.168.0.10","TCP","96","15152  >  49209 [PSH, ACK] Seq=14655 Ack=2780 Win=32230 Len=42"
"376","0.023808","206.127.152.131","192.168.0.10","TCP","96","15152  >  49209 [PSH, ACK] Seq=14697 Ack=2806 Win=32204 Len=42"
"378","0.024234","206.127.152.131","192.168.0.10","TCP","96","15152  >  49209 [PSH, ACK] Seq=14739 Ack=2832 Win=32178 Len=42"
"381","0.022719","206.127.152.131","192.168.0.10","TCP","96","15152  >  49209 [PSH, ACK] Seq=14781 Ack=2858 Win=32152 Len=42"
"382","0.007875","206.127.152.131","192.168.0.10","TCP","93","15152  >  49209 [PSH, ACK] Seq=14823 Ack=2889 Win=32121 Len=39"
"385","0.024306","206.127.152.131","192.168.0.10","TCP","96","15152  >  49209 [PSH, ACK] Seq=14862 Ack=2915 Win=32095 Len=42"
"388","0.025300","206.127.152.131","192.168.0.10","TCP","96","15152  >  49209 [PSH, ACK] Seq=14904 Ack=2941 Win=32069 Len=42"
"389","0.150007","206.127.152.131","192.168.0.10","TCP","65","15152  >  49209 [PSH, ACK] Seq=14946 Ack=2941 Win=32069 Len=11"
"391","0.000354","206.127.152.131","192.168.0.10","TCP","69","15152  >  49209 [PSH, ACK] Seq=14957 Ack=2941 Win=32069 Len=15"
"396","0.025087","206.127.152.131","192.168.0.10","TCP","96","15152  >  49209 [PSH, ACK] Seq=14972 Ack=2989 Win=32021 Len=42"
"398","0.025882","206.127.152.131","192.168.0.10","TCP","182","15152  >  49209 [PSH, ACK] Seq=15014 Ack=3020 Win=31990 Len=128"
"404","0.001412","206.127.152.131","192.168.0.10","TCP","96","15152  >  49209 [PSH, ACK] Seq=15142 Ack=3098 Win=31912 Len=42"
"405","0.021473","206.127.152.131","192.168.0.10","TCP","65","15152  >  49209 [PSH, ACK] Seq=15184 Ack=3098 Win=31912 Len=11"
"407","0.000814","206.127.152.131","192.168.0.10","TCP","69","15152  >  49209 [PSH, ACK] Seq=15195 Ack=3098 Win=31912 Len=15"
"411","0.001494","206.127.152.131","192.168.0.10","TCP","96","15152  >  49209 [PSH, ACK] Seq=15210 Ack=3135 Win=31875 Len=42"
"413","0.024461","206.127.152.131","192.168.0.10","TCP","96","15152  >  49209 [PSH, ACK] Seq=15252 Ack=3161 Win=31849 Len=42"
"416","0.022364","206.127.152.131","192.168.0.10","TCP","96","15152  >  49209 [PSH, ACK] Seq=15294 Ack=3187 Win=31823 Len=42"
"417","0.008130","206.127.152.131","192.168.0.10","TCP","93","15152  >  49209 [PSH, ACK] Seq=15336 Ack=3218 Win=31792 Len=39"
"420","0.025902","206.127.152.131","192.168.0.10","TCP","96","15152  >  49209 [PSH, ACK] Seq=15375 Ack=3244 Win=31766 Len=42"
"422","0.026106","206.127.152.131","192.168.0.10","TCP","182","15152  >  49209 [PSH, ACK] Seq=15417 Ack=3275 Win=31735 Len=128"
"426","0.190459","206.127.152.131","192.168.0.10","TCP","65","15152  >  49209 [PSH, ACK] Seq=15545 Ack=3312 Win=31698 Len=11"
"427","0.000932","206.127.152.131","192.168.0.10","TCP","69","15152  >  49209 [PSH, ACK] Seq=15556 Ack=3312 Win=31698 Len=15"
"434","0.001466","206.127.152.131","192.168.0.10","TCP","96","15152  >  49209 [PSH, ACK] Seq=15571 Ack=3375 Win=31635 Len=42"
"436","0.023837","206.127.152.131","192.168.0.10","TCP","96","15152  >  49209 [PSH, ACK] Seq=15613 Ack=3401 Win=31609 Len=42"
"438","0.025348","206.127.152.131","192.168.0.10","TCP","96","15152  >  49209 [PSH, ACK] Seq=15655 Ack=3427 Win=31583 Len=42"
"440","0.024553","206.127.152.131","192.168.0.10","TCP","93","15152  >  49209 [PSH, ACK] Seq=15697 Ack=3458 Win=31552 Len=39"
"443","0.025416","206.127.152.131","192.168.0.10","TCP","96","15152  >  49209 [PSH, ACK] Seq=15736 Ack=3484 Win=31526 Len=42"
"444","0.004877","206.127.152.131","192.168.0.10","TCP","65","15152  >  49209 [PSH, ACK] Seq=15778 Ack=3484 Win=31526 Len=11"
"446","0.000969","206.127.152.131","192.168.0.10","TCP","69","15152  >  49209 [PSH, ACK] Seq=15789 Ack=3484 Win=31526 Len=15"
"450","0.024121","206.127.152.131","192.168.0.10","TCP","96","15152  >  49209 [PSH, ACK] Seq=15804 Ack=3521 Win=31489 Len=42"
"452","0.025404","206.127.152.131","192.168.0.10","TCP","182","15152  >  49209 [PSH, ACK] Seq=15846 Ack=3552 Win=31458 Len=128"
"457","0.024175","206.127.152.131","192.168.0.10","TCP","96","15152  >  49209 [PSH, ACK] Seq=15974 Ack=3615 Win=31395 Len=42"
"459","0.025880","206.127.152.131","192.168.0.10","TCP","96","15152  >  49209 [PSH, ACK] Seq=16016 Ack=3641 Win=31369 Len=42"
"460","0.046573","206.127.152.131","192.168.0.10","TCP","65","15152  >  49209 [PSH, ACK] Seq=16058 Ack=3641 Win=31369 Len=11"
"462","0.000821","206.127.152.131","192.168.0.10","TCP","69","15152  >  49209 [PSH, ACK] Seq=16069 Ack=3641 Win=31369 Len=15"
"466","0.024203","206.127.152.131","192.168.0.10","TCP","96","15152  >  49209 [PSH, ACK] Seq=16084 Ack=3678 Win=31332 Len=42"
"468","0.023783","206.127.152.131","192.168.0.10","TCP","96","15152  >  49209 [PSH, ACK] Seq=16126 Ack=3704 Win=32768 Len=42"
"470","0.023671","206.127.152.131","192.168.0.10","TCP","96","15152  >  49209 [PSH, ACK] Seq=16168 Ack=3730 Win=32742 Len=42"
"472","0.023676","206.127.152.131","192.168.0.10","TCP","96","15152  >  49209 [PSH, ACK] Seq=16210 Ack=3756 Win=32716 Len=42"
"474","0.023502","206.127.152.131","192.168.0.10","TCP","96","15152  >  49209 [PSH, ACK] Seq=16252 Ack=3782 Win=32690 Len=42"
"476","0.023491","206.127.152.131","192.168.0.10","TCP","96","15152  >  49209 [PSH, ACK] Seq=16294 Ack=3808 Win=32664 Len=42"
"478","0.025989","206.127.152.131","192.168.0.10","TCP","96","15152  >  49209 [PSH, ACK] Seq=16336 Ack=3834 Win=32638 Len=42"
"479","0.099810","206.127.152.131","192.168.0.10","TCP","65","15152  >  49209 [PSH, ACK] Seq=16378 Ack=3834 Win=32638 Len=11"
"481","0.001090","206.127.152.131","192.168.0.10","TCP","69","15152  >  49209 [PSH, ACK] Seq=16389 Ack=3834 Win=32638 Len=15"
"485","0.001472","206.127.152.131","192.168.0.10","TCP","96","15152  >  49209 [PSH, ACK] Seq=16404 Ack=3871 Win=32601 Len=42"
"487","0.024893","206.127.152.131","192.168.0.10","TCP","93","15152  >  49209 [PSH, ACK] Seq=16446 Ack=3902 Win=32570 Len=39"
"489","0.024025","206.127.152.131","192.168.0.10","TCP","96","15152  >  49209 [PSH, ACK] Seq=16485 Ack=3928 Win=32544 Len=42"
"491","0.023932","206.127.152.131","192.168.0.10","TCP","96","15152  >  49209 [PSH, ACK] Seq=16527 Ack=3954 Win=32518 Len=42"
"493","0.025048","206.127.152.131","192.168.0.10","TCP","109","15152  >  49209 [PSH, ACK] Seq=16569 Ack=3985 Win=32487 Len=55"
"495","0.023801","206.127.152.131","192.168.0.10","TCP","81","15152  >  49209 [PSH, ACK] Seq=16624 Ack=4008 Win=32464 Len=27"
"497","0.025056","206.127.152.131","192.168.0.10","TCP","96","15152  >  49209 [PSH, ACK] Seq=16651 Ack=4034 Win=32438 Len=42"
"500","0.024521","206.127.152.131","192.168.0.10","TCP","96","15152  >  49209 [PSH, ACK] Seq=16693 Ack=4060 Win=32412 Len=42"
"501","0.100522","206.127.152.131","192.168.0.10","TCP","65","15152  >  49209 [PSH, ACK] Seq=16735 Ack=4060 Win=32412 Len=11"
"503","0.000916","206.127.152.131","192.168.0.10","TCP","69","15152  >  49209 [PSH, ACK] Seq=16746 Ack=4060 Win=32412 Len=15"
"507","0.025207","206.127.152.131","192.168.0.10","TCP","96","15152  >  49209 [PSH, ACK] Seq=16761 Ack=4097 Win=32375 Len=42"
"511","0.001167","206.127.152.131","192.168.0.10","TCP","96","15152  >  49209 [PSH, ACK] Seq=16803 Ack=4134 Win=32338 Len=42"
"514","0.025102","206.127.152.131","192.168.0.10","TCP","96","15152  >  49209 [PSH, ACK] Seq=16845 Ack=4160 Win=32312 Len=42"
"516","0.024862","206.127.152.131","192.168.0.10","TCP","96","15152  >  49209 [PSH, ACK] Seq=16887 Ack=4186 Win=32286 Len=42"
"518","0.024355","206.127.152.131","192.168.0.10","TCP","96","15152  >  49209 [PSH, ACK] Seq=16929 Ack=4212 Win=32260 Len=42"
"520","0.024139","206.127.152.131","192.168.0.10","TCP","96","15152  >  49209 [PSH, ACK] Seq=16971 Ack=4238 Win=32234 Len=42"
"521","0.099519","206.127.152.131","192.168.0.10","TCP","65","15152  >  49209 [PSH, ACK] Seq=17013 Ack=4238 Win=32234 Len=11"
"523","0.016432","206.127.152.131","192.168.0.10","TCP","65","15152  >  49209 [PSH, ACK] Seq=17024 Ack=4238 Win=32234 Len=11"
"524","0.000984","206.127.152.131","192.168.0.10","TCP","69","15152  >  49209 [PSH, ACK] Seq=17035 Ack=4238 Win=32234 Len=15"
"529","0.001452","206.127.152.131","192.168.0.10","TCP","96","15152  >  49209 [PSH, ACK] Seq=17050 Ack=4275 Win=32197 Len=42"
"531","0.024567","206.127.152.131","192.168.0.10","TCP","96","15152  >  49209 [PSH, ACK] Seq=17092 Ack=4301 Win=32171 Len=42"
"533","0.023815","206.127.152.131","192.168.0.10","TCP","96","15152  >  49209 [PSH, ACK] Seq=17134 Ack=4327 Win=32145 Len=42"
"536","0.002799","206.127.152.131","192.168.0.10","TCP","96","15152  >  49209 [PSH, ACK] Seq=17176 Ack=4353 Win=32119 Len=42"
"537","0.021441","206.127.152.131","192.168.0.10","TCP","93","15152  >  49209 [PSH, ACK] Seq=17218 Ack=4384 Win=32088 Len=39"
"540","0.024772","206.127.152.131","192.168.0.10","TCP","96","15152  >  49209 [PSH, ACK] Seq=17257 Ack=4410 Win=32062 Len=42"
"545","0.024149","206.127.152.131","192.168.0.10","TCP","96","15152  >  49209 [PSH, ACK] Seq=17299 Ack=4447 Win=32025 Len=42"
"546","0.007870","206.127.152.131","192.168.0.10","TCP","109","15152  >  49209 [PSH, ACK] Seq=17341 Ack=4478 Win=31994 Len=55"
"548","0.112986","206.127.152.131","192.168.0.10","TCP","65","15152  >  49209 [PSH, ACK] Seq=17396 Ack=4478 Win=31994 Len=11"
"549","0.000901","206.127.152.131","192.168.0.10","TCP","69","15152  >  49209 [PSH, ACK] Seq=17407 Ack=4478 Win=31994 Len=15"
"554","0.000960","206.127.152.131","192.168.0.10","TCP","81","15152  >  49209 [PSH, ACK] Seq=17422 Ack=4512 Win=31960 Len=27"
"556","0.024707","206.127.152.131","192.168.0.10","TCP","96","15152  >  49209 [PSH, ACK] Seq=17449 Ack=4538 Win=31934 Len=42"
"558","0.025320","206.127.152.131","192.168.0.10","TCP","96","15152  >  49209 [PSH, ACK] Seq=17491 Ack=4564 Win=31908 Len=42"
"560","0.025691","206.127.152.131","192.168.0.10","TCP","96","15152  >  49209 [PSH, ACK] Seq=17533 Ack=4590 Win=31882 Len=42"
"563","0.023444","206.127.152.131","192.168.0.10","TCP","96","15152  >  49209 [PSH, ACK] Seq=17575 Ack=4616 Win=31856 Len=42"
"564","0.006866","206.127.152.131","192.168.0.10","TCP","93","15152  >  49209 [PSH, ACK] Seq=17617 Ack=4647 Win=31825 Len=39"
"571","0.001509","206.127.152.131","192.168.0.10","TCP","93","15152  >  49209 [PSH, ACK] Seq=17656 Ack=4689 Win=31783 Len=39"
"572","0.014998","206.127.152.131","192.168.0.10","TCP","65","15152  >  49209 [PSH, ACK] Seq=17695 Ack=4696 Win=31776 Len=11"
"574","0.008538","206.127.152.131","192.168.0.10","TCP","96","15152  >  49209 [PSH, ACK] Seq=17706 Ack=4722 Win=31750 Len=42"
"578","0.010156","206.127.152.131","192.168.0.10","TCP","65","15152  >  49209 [PSH, ACK] Seq=17748 Ack=4722 Win=31750 Len=11"
"579","0.000951","206.127.152.131","192.168.0.10","TCP","69","15152  >  49209 [PSH, ACK] Seq=17759 Ack=4722 Win=31750 Len=15"
"581","0.012563","206.127.152.131","192.168.0.10","TCP","96","15152  >  49209 [PSH, ACK] Seq=17774 Ack=4748 Win=31724 Len=42"
"585","0.025485","206.127.152.131","192.168.0.10","TCP","93","15152  >  49209 [PSH, ACK] Seq=17816 Ack=4801 Win=31671 Len=39"
"587","0.025019","206.127.152.131","192.168.0.10","TCP","96","15152  >  49209 [PSH, ACK] Seq=17855 Ack=4827 Win=31645 Len=42"
"590","0.022967","206.127.152.131","192.168.0.10","TCP","81","15152  >  49209 [PSH, ACK] Seq=17897 Ack=4850 Win=31622 Len=27"
"592","0.025456","206.127.152.131","192.168.0.10","TCP","96","15152  >  49209 [PSH, ACK] Seq=17924 Ack=4876 Win=31596 Len=42"
"594","0.023376","206.127.152.131","192.168.0.10","TCP","96","15152  >  49209 [PSH, ACK] Seq=17966 Ack=4902 Win=31570 Len=42"
"596","0.115378","206.127.152.131","192.168.0.10","TCP","65","15152  >  49209 [PSH, ACK] Seq=18008 Ack=4913 Win=31559 Len=11"
"597","0.000462","206.127.152.131","192.168.0.10","TCP","69","15152  >  49209 [PSH, ACK] Seq=18019 Ack=4913 Win=31559 Len=15"
"602","0.001448","206.127.152.131","192.168.0.10","TCP","96","15152  >  49209 [PSH, ACK] Seq=18034 Ack=4950 Win=31522 Len=42"
"604","0.023481","206.127.152.131","192.168.0.10","TCP","93","15152  >  49209 [PSH, ACK] Seq=18076 Ack=4981 Win=31491 Len=39"
"606","0.025129","206.127.152.131","192.168.0.10","TCP","96","15152  >  49209 [PSH, ACK] Seq=18115 Ack=5007 Win=31465 Len=42"
"610","0.001425","206.127.152.131","192.168.0.10","TCP","93","15152  >  49209 [PSH, ACK] Seq=18157 Ack=5049 Win=31423 Len=39"
"615","0.001435","206.127.152.131","192.168.0.10","TCP","93","15152  >  49209 [PSH, ACK] Seq=18196 Ack=5091 Win=31381 Len=39"
"616","0.020052","206.127.152.131","192.168.0.10","TCP","96","15152  >  49209 [PSH, ACK] Seq=18235 Ack=5117 Win=31355 Len=42"
"619","0.024106","206.127.152.131","192.168.0.10","TCP","109","15152  >  49209 [PSH, ACK] Seq=18277 Ack=5148 Win=31324 Len=55"
"620","0.001436","206.127.152.131","192.168.0.10","TCP","71","15152  >  49209 [PSH, ACK] Seq=18332 Ack=5148 Win=31324 Len=17"
"623","0.025992","206.127.152.131","192.168.0.10","TCP","81","15152  >  49209 [PSH, ACK] Seq=18349 Ack=5171 Win=32768 Len=27"
"625","0.025605","206.127.152.131","192.168.0.10","TCP","96","15152  >  49209 [PSH, ACK] Seq=18376 Ack=5197 Win=32742 Len=42"
"627","0.024810","206.127.152.131","192.168.0.10","TCP","96","15152  >  49209 [PSH, ACK] Seq=18418 Ack=5223 Win=32716 Len=42"
"631","0.001446","206.127.152.131","192.168.0.10","TCP","93","15152  >  49209 [PSH, ACK] Seq=18460 Ack=5265 Win=32674 Len=39"
"632","0.104952","206.127.152.131","192.168.0.10","TCP","65","15152  >  49209 [PSH, ACK] Seq=18499 Ack=5265 Win=32674 Len=11"
"634","0.000815","206.127.152.131","192.168.0.10","TCP","69","15152  >  49209 [PSH, ACK] Seq=18510 Ack=5265 Win=32674 Len=15"
"638","0.001485","206.127.152.131","192.168.0.10","TCP","96","15152  >  49209 [PSH, ACK] Seq=18525 Ack=5302 Win=32637 Len=42"
"640","0.026161","206.127.152.131","192.168.0.10","TCP","81","15152  >  49209 [PSH, ACK] Seq=18567 Ack=5325 Win=32614 Len=27"
"642","0.023318","206.127.152.131","192.168.0.10","TCP","96","15152  >  49209 [PSH, ACK] Seq=18594 Ack=5351 Win=32588 Len=42"
"646","0.000757","206.127.152.131","192.168.0.10","TCP","96","15152  >  49209 [PSH, ACK] Seq=18636 Ack=5388 Win=32551 Len=42"
"648","0.025085","206.127.152.131","192.168.0.10","TCP","96","15152  >  49209 [PSH, ACK] Seq=18678 Ack=5414 Win=32525 Len=42"
"650","0.025059","206.127.152.131","192.168.0.10","TCP","96","15152  >  49209 [PSH, ACK] Seq=18720 Ack=5440 Win=32499 Len=42"
"652","0.024993","206.127.152.131","192.168.0.10","TCP","96","15152  >  49209 [PSH, ACK] Seq=18762 Ack=5466 Win=32473 Len=42"
"654","0.023854","206.127.152.131","192.168.0.10","TCP","96","15152  >  49209 [PSH, ACK] Seq=18804 Ack=5492 Win=32447 Len=42"
"655","0.153961","206.127.152.131","192.168.0.10","TCP","65","15152  >  49209 [PSH, ACK] Seq=18846 Ack=5492 Win=32447 Len=11"
"657","0.000923","206.127.152.131","192.168.0.10","TCP","69","15152  >  49209 [PSH, ACK] Seq=18857 Ack=5492 Win=32447 Len=15"
"661","0.024311","206.127.152.131","192.168.0.10","TCP","96","15152  >  49209 [PSH, ACK] Seq=18872 Ack=5529 Win=32410 Len=42"
"663","0.024289","206.127.152.131","192.168.0.10","TCP","96","15152  >  49209 [PSH, ACK] Seq=18914 Ack=5555 Win=32384 Len=42"
"666","0.024040","206.127.152.131","192.168.0.10","TCP","96","15152  >  49209 [PSH, ACK] Seq=18956 Ack=5581 Win=32358 Len=42"
"669","0.023502","206.127.152.131","192.168.0.10","TCP","96","15152  >  49209 [PSH, ACK] Seq=18998 Ack=5607 Win=32332 Len=42"
"671","0.024905","206.127.152.131","192.168.0.10","TCP","96","15152  >  49209 [PSH, ACK] Seq=19040 Ack=5633 Win=32306 Len=42"
"672","0.118018","206.127.152.131","192.168.0.10","TCP","65","15152  >  49209 [PSH, ACK] Seq=19082 Ack=5633 Win=32306 Len=11"
"674","0.000819","206.127.152.131","192.168.0.10","TCP","69","15152  >  49209 [PSH, ACK] Seq=19093 Ack=5633 Win=32306 Len=15"
"678","0.000968","206.127.152.131","192.168.0.10","TCP","96","15152  >  49209 [PSH, ACK] Seq=19108 Ack=5670 Win=32269 Len=42"
"680","0.025036","206.127.152.131","192.168.0.10","TCP","182","15152  >  49209 [PSH, ACK] Seq=19150 Ack=5701 Win=32238 Len=128"
"684","0.024302","206.127.152.131","192.168.0.10","TCP","96","15152  >  49209 [PSH, ACK] Seq=19278 Ack=5753 Win=32186 Len=42"
"686","0.024648","206.127.152.131","192.168.0.10","TCP","96","15152  >  49209 [PSH, ACK] Seq=19320 Ack=5779 Win=32160 Len=42"
"687","0.029075","206.127.152.131","192.168.0.10","TCP","65","15152  >  49209 [PSH, ACK] Seq=19362 Ack=5779 Win=32160 Len=11"
"689","0.000823","206.127.152.131","192.168.0.10","TCP","69","15152  >  49209 [PSH, ACK] Seq=19373 Ack=5779 Win=32160 Len=15"
"693","0.004414","206.127.152.131","192.168.0.10","TCP","96","15152  >  49209 [PSH, ACK] Seq=19388 Ack=5816 Win=32123 Len=42"
"695","0.025062","206.127.152.131","192.168.0.10","TCP","96","15152  >  49209 [PSH, ACK] Seq=19430 Ack=5842 Win=32097 Len=42"
"697","0.023526","206.127.152.131","192.168.0.10","TCP","93","15152  >  49209 [PSH, ACK] Seq=19472 Ack=5873 Win=32066 Len=39"
"700","0.023677","206.127.152.131","192.168.0.10","TCP","96","15152  >  49209 [PSH, ACK] Seq=19511 Ack=5899 Win=32040 Len=42"
"702","0.025037","206.127.152.131","192.168.0.10","TCP","182","15152  >  49209 [PSH, ACK] Seq=19553 Ack=5930 Win=32009 Len=128"
"706","0.173187","206.127.152.131","192.168.0.10","TCP","65","15152  >  49209 [PSH, ACK] Seq=19681 Ack=5967 Win=31972 Len=11"
"707","0.001488","206.127.152.131","192.168.0.10","TCP","69","15152  >  49209 [PSH, ACK] Seq=19692 Ack=5967 Win=31972 Len=15"
"713","0.000909","206.127.152.131","192.168.0.10","TCP","96","15152  >  49209 [PSH, ACK] Seq=19707 Ack=6004 Win=31935 Len=42"
"714","0.023148","206.127.152.131","192.168.0.10","TCP","96","15152  >  49209 [PSH, ACK] Seq=19749 Ack=6030 Win=31909 Len=42"
"717","0.025730","206.127.152.131","192.168.0.10","TCP","96","15152  >  49209 [PSH, ACK] Seq=19791 Ack=6056 Win=31883 Len=42"
"720","0.002218","206.127.152.131","192.168.0.10","TCP","96","15152  >  49209 [PSH, ACK] Seq=19833 Ack=6082 Win=31857 Len=42"
"721","0.023874","206.127.152.131","192.168.0.10","TCP","96","15152  >  49209 [PSH, ACK] Seq=19875 Ack=6108 Win=31831 Len=42"
"723","0.122910","206.127.152.131","192.168.0.10","TCP","65","15152  >  49209 [PSH, ACK] Seq=19917 Ack=6108 Win=31831 Len=11"
"724","0.001195","206.127.152.131","192.168.0.10","TCP","69","15152  >  49209 [PSH, ACK] Seq=19928 Ack=6108 Win=31831 Len=15"
"729","0.001477","206.127.152.131","192.168.0.10","TCP","96","15152  >  49209 [PSH, ACK] Seq=19943 Ack=6145 Win=31794 Len=42"
"731","0.023732","206.127.152.131","192.168.0.10","TCP","93","15152  >  49209 [PSH, ACK] Seq=19985 Ack=6176 Win=31763 Len=39"
"734","0.024993","206.127.152.131","192.168.0.10","TCP","182","15152  >  49209 [PSH, ACK] Seq=20024 Ack=6207 Win=31732 Len=128"
"738","0.006167","206.127.152.131","192.168.0.10","TCP","65","15152  >  49209 [PSH, ACK] Seq=20152 Ack=6244 Win=31695 Len=11"
"739","0.000973","206.127.152.131","192.168.0.10","TCP","69","15152  >  49209 [PSH, ACK] Seq=20163 Ack=6244 Win=31695 Len=15"
"741","0.017506","206.127.152.131","192.168.0.10","TCP","96","15152  >  49209 [PSH, ACK] Seq=20178 Ack=6270 Win=31669 Len=42"
"745","0.000959","206.127.152.131","192.168.0.10","TCP","96","15152  >  49209 [PSH, ACK] Seq=20220 Ack=6307 Win=31632 Len=42"
"748","0.025356","206.127.152.131","192.168.0.10","TCP","96","15152  >  49209 [PSH, ACK] Seq=20262 Ack=6333 Win=31606 Len=42"
"750","0.024364","206.127.152.131","192.168.0.10","TCP","93","15152  >  49209 [PSH, ACK] Seq=20304 Ack=6364 Win=31575 Len=39"
"751","0.083944","206.127.152.131","192.168.0.10","TCP","73","15152  >  49209 [PSH, ACK] Seq=20343 Ack=6364 Win=31575 Len=19"
"756","0.001475","206.127.152.131","192.168.0.10","TCP","96","15152  >  49209 [PSH, ACK] Seq=20362 Ack=6409 Win=31530 Len=42"
"758","0.026491","206.127.152.131","192.168.0.10","TCP","182","15152  >  49209 [PSH, ACK] Seq=20404 Ack=6440 Win=31499 Len=128"
"762","0.062597","206.127.152.131","192.168.0.10","TCP","65","15152  >  49209 [PSH, ACK] Seq=20532 Ack=6477 Win=31462 Len=11"
"763","0.000958","206.127.152.131","192.168.0.10","TCP","69","15152  >  49209 [PSH, ACK] Seq=20543 Ack=6477 Win=31462 Len=15"
"768","0.024402","206.127.152.131","192.168.0.10","TCP","96","15152  >  49209 [PSH, ACK] Seq=20558 Ack=6514 Win=31425 Len=42"
"770","0.023466","206.127.152.131","192.168.0.10","TCP","96","15152  >  49209 [PSH, ACK] Seq=20600 Ack=6540 Win=31399 Len=42"
"773","0.024369","206.127.152.131","192.168.0.10","TCP","96","15152  >  49209 [PSH, ACK] Seq=20642 Ack=6566 Win=31373 Len=42"
"775","0.025517","206.127.152.131","192.168.0.10","TCP","96","15152  >  49209 [PSH, ACK] Seq=20684 Ack=6592 Win=31347 Len=42"
"776","0.066509","206.127.152.131","192.168.0.10","TCP","71","15152  >  49209 [PSH, ACK] Seq=20726 Ack=6592 Win=31347 Len=17"
"778","0.000887","206.127.152.131","192.168.0.10","TCP","65","15152  >  49209 [PSH, ACK] Seq=20743 Ack=6592 Win=31347 Len=11"
"779","0.000976","206.127.152.131","192.168.0.10","TCP","69","15152  >  49209 [PSH, ACK] Seq=20754 Ack=6592 Win=31347 Len=15"
"784","0.018455","206.127.152.131","192.168.0.10","TCP","96","15152  >  49209 [PSH, ACK] Seq=20769 Ack=6629 Win=32768 Len=42"
"788","0.024903","206.127.152.131","192.168.0.10","TCP","182","15152  >  49209 [PSH, ACK] Seq=20811 Ack=6660 Win=32737 Len=128"
"791","0.395455","206.127.152.131","192.168.0.10","TCP","65","15152  >  49209 [PSH, ACK] Seq=20939 Ack=6712 Win=32685 Len=11"
"792","0.000893","206.127.152.131","192.168.0.10","TCP","69","15152  >  49209 [PSH, ACK] Seq=20950 Ack=6712 Win=32685 Len=15"
"797","0.003407","206.127.152.131","192.168.0.10","TCP","96","15152  >  49209 [PSH, ACK] Seq=20965 Ack=6749 Win=32648 Len=42"
"799","0.024839","206.127.152.131","192.168.0.10","TCP","96","15152  >  49209 [PSH, ACK] Seq=21007 Ack=6775 Win=32622 Len=42"
"802","0.024034","206.127.152.131","192.168.0.10","TCP","96","15152  >  49209 [PSH, ACK] Seq=21049 Ack=6801 Win=32596 Len=42"
"804","0.026024","206.127.152.131","192.168.0.10","TCP","93","15152  >  49209 [PSH, ACK] Seq=21091 Ack=6832 Win=32565 Len=39"
"806","0.025788","206.127.152.131","192.168.0.10","TCP","96","15152  >  49209 [PSH, ACK] Seq=21130 Ack=6858 Win=32539 Len=42"
"808","0.024313","206.127.152.131","192.168.0.10","TCP","96","15152  >  49209 [PSH, ACK] Seq=21172 Ack=6884 Win=32513 Len=42"
"810","0.171145","206.127.152.131","192.168.0.10","TCP","65","15152  >  49209 [PSH, ACK] Seq=21214 Ack=6884 Win=32513 Len=11"
"811","0.000920","206.127.152.131","192.168.0.10","TCP","69","15152  >  49209 [PSH, ACK] Seq=21225 Ack=6884 Win=32513 Len=15"
"816","0.001455","206.127.152.131","192.168.0.10","TCP","96","15152  >  49209 [PSH, ACK] Seq=21240 Ack=6921 Win=32476 Len=42"
"818","0.025395","206.127.152.131","192.168.0.10","TCP","182","15152  >  49209 [PSH, ACK] Seq=21282 Ack=6952 Win=32445 Len=128"
"823","0.024507","206.127.152.131","192.168.0.10","TCP","96","15152  >  49209 [PSH, ACK] Seq=21410 Ack=7015 Win=32382 Len=42"
"825","0.025133","206.127.152.131","192.168.0.10","TCP","96","15152  >  49209 [PSH, ACK] Seq=21452 Ack=7041 Win=32356 Len=42"
